,name,qualification,specialization,clinic_address,timing_days,timing_session,review_score,consultation_fee,current_url,feedbacks
34,Dr. Sandeep Sarao,BHMS,"AYUSHHomoeopath
15 Years Experience Overall","A-160, Vikas Marg, Landmark: Opposite Metro Pillar 42, Delhi",Mon - Sat,"11:30 AM - 02:00 PM
05:30 PM - 08:30 PM",97% (200 votes),₹500,https://www.practo.com/delhi/doctor/dr-sandeep-sarao-homeopath?practice_id=708984&specialization=Homoeopath&referrer=doctor_listing,"[""I recommend the doctorIt was good experience with Doc, and i would surely recommended him for any homeopathic related treatment.Medicine is good and worked for me big time. He is very reachable anytime even on 'whatsapp' and try to make everything as per your convenient."", 'I recommend the doctorDr. Sandeep is one who understands his patient and tries to go into the root cause analysis. This gives patient a sense of satisfaction and confidence that he/she is visiting a right doctor. I had stone problem in kidney as per the ultrasound report (9mm & 5mm) and with doctors treatment the next Ultrasound report after 3 months it reduced to 4mm & nil.Thus, it is a good experience visiting the doctor Sandeep.', 'I recommend the doctorHappy with: Doctor friendlinessThank you, Dr. Sarao. He was doctor-cum-friend who talked to me and have a detailed conversation or a discussion about myself, which I thought it would be a disease. He helped me to rethink again and take my proper decision. I loved the way he took each points and explained me everything what I wanted. I was not clear with my thoughts but yes,after a session with him, I am happy and satisfied. Thanks for the beautiful time.Dr. Sandeep Sarao repliedI am glad to be of any help to you. Never under estimate yourself and continue to believe in what’s right. Have a happy life.', 'Visited For Peptic / Gastric Ulcer TreatmentI recommend the doctorMy chronic problem got better only after homeopathic treatment. Thanks to doctor for curing me for my problem . I recommend this', ""I recommend the doctorIt was good, the reason is clear that i 've found lots of improvement for my health (in hair) . But I'm expecting something more. I believe that it will be fine for my health (hair)."", 'I recommend the doctorI fill much better after visit here.and I relief.I hope not I am sure my problem will control if I will take my medicine according to doctor because he is very experienced.he find out root of problems.', 'I recommend the doctorGood experience I have as the diagnosis of the disease so I am satisfied and disease is decrease from the beginning and I will definitely get rid of from the same.Thanks', ""Visited For Stomach DisorderI recommend the doctorVery Understanding and Good Suggestion for medicines as well as Advice's too.Results also showing at its best so overall best doc facility available in this locality."", 'I recommend the doctorvery co-operative in nature , & since the doctor is very young , i was able to explain all the problems with him', 'I recommend the doctorThis is the first time to take consultancy for my daughter suffering from skin problem .I am taking treatment for last two months and waiting for relief as in homeopathic it will take time but remove permanently.']"

35,Dr. Sutapa Datta,BHMS,"AYUSHHomoeopath
15 Years Experience Overall","C-5A/25,Near Ram Mandir,Opposite V k Jewellers, Landmark: Opposite V k Jewellers, Delhi",Mon - Sat,"11:00 AM - 02:00 PM
06:00 PM - 08:30 PM",,₹200,https://www.practo.com/delhi/doctor/dr-sutapa-datta-homoeopath?practice_id=1169187&specialization=Homoeopath&referrer=doctor_listing,"['I recommend the doctorI am very grateful to Dr. Sutapa ** *** ***** ** ** *** old chronic problem which I assumed as incurable. She listens with great patience. I feel blessed to have such a good doctor.', 'I recommend the doctorThe doctor is very calm and sweet in nature, as she tackle the serious situations in very simple ways moreover, *** ********* *** **** ********* ***** *** ***********', ""I recommend the doctorMy major concern was Hair thining and hair fall . I visit to her 2months back , and I can proudly say that am so much satisfied with her homeo medicines now . I can see my hair growth and thickness . I'll recommend you to visit her for hair problem.Thank you Dr. Sutapa"", 'Visited For chronic complaintsI recommend the doctorHappy with: Explanation of the health issueVery honest and straightforward! Highly recommended. It really helped me with my long time chronic erticeria problem.', ""I recommend the doctorHappy with: Doctor friendlinessExplanation of the health issueTreatment satisfactionValue for moneyShe is really a gud n intelligent doctor , gives full time to listen the patient's problems. *** ********* ** **** **** ********** Full 100% marks for her. She really deserves recommendation."", 'Visited For Bronchitis TreatmentI recommend the doctorHappy with: Doctor friendlinessExplanation of the health issueTreatment satisfactionValue for moneyWonderful. She was able to find out the issue very easily n resolved it in a short time with limited no of medicines !', 'Visited For Skin Specialist through HomoeopathyI recommend the doctorHappy with: Doctor friendlinessExplanation of the health issueTreatment satisfactionValue for moneyWait timeI got immediate recovery after the medicine and the the doctor had a fair idea about the disease & treatment.', ""I recommend the doctorHappy with: Doctor friendlinessTreatment satisfactionDoctor is very friendly and I am very well satisfied with the treatment given by her.. she listen to the patient's carefully ..I always think that homeopathy medicine takes time but I was wrong..I got the relief in one day..""]"

36,Dr. Chander Vansh Bareja,BHMS,"AYUSHHomoeopath
12 Years Experience Overall","42-A, PD Block, Landmark: Near ND Market, Delhi",Mon - Wed,"10:30 AM - 01:00 PM
06:00 PM - 08:30 PM",100% (212 votes),₹500,https://www.practo.com/delhi/doctor/dr-chander-vansh-bareja-homeopath-1?practice_id=1110143&specialization=Homoeopath&referrer=doctor_listing,"['Visited For Acidity TreatmentI recommend the doctorHappy with: Doctor friendlinessExplanation of the health issueTreatment satisfactionValue for moneyWait timeExperience with doctor has been good. Homoeopathy has solved alot of problems. ....................', 'I recommend the doctorHappy with: Doctor friendlinessExplanation of the health issueTreatment satisfactionValue for moneyWait timeI have a very good experience ! 1 st I use to get lot of cold and cough ! Now slowly it has vanished I had irregular periods and back ache !He is very polite to talk to he listens my health issues L really well and I get fine with his 1st dose only !Best pet very nominal fees and he send my medicines where ever I am in a day if m out of delhi !Very nice doctor !', 'I recommend the doctorHappy with: Doctor friendlinessExplanation of the health issueTreatment satisfactionValue for moneyI know him since last so many years and I never not disappointed with the treatment and behaviour ever.', 'Visited For ConsultantI recommend the doctorHappy with: Doctor friendlinessExplanation of the health issueTreatment satisfactionValue for moneyWait timeI had a great experience with Dr vansh ji. He is like our family doctor and his medicines is very effective. Whenever I am ill he is the saviour.', ""I recommend the doctorHappy with: Treatment satisfactionExplanation of the health issueDoctor friendlinessValue for moneyWait timeDr Chandervansh has been a life saver for us....After Mitral Regurgitation was diagnosed and open heart surgery prescribed, we were completely shattered. Surgeons in Medanta recommended to get the surgery done asap; we met Dr Vansh for an unbiased opinion and he asked to delay the surgery and start homeo treatment. It started to show results within a few weeks and symptoms started to improve. It has been more than 03 years and I am able to cope up without any open heart.It has all been possible because of Dr Vansh's treatment. I shall always be indebted to him. He is not only my doctor but also has been our family physician since then."", 'I recommend the doctorHappy with: Doctor friendlinessTreatment satisfactionExplanation of the health issueValue for moneyWait time""The remedies worked, I feel a lot better now than when I first met him. My condition has improved significantly *** * ** ****** ***** ***** *******I also would like to take this opportunity to thank you, Dr. Chander Vansh , again for all your selfless efforts in trying to understand my medical condition and in your faith (and uplifting mine too) **** ** *** ** ***** **** ******* ********* I also pray that the good Lord also bless you with more knowledge, strength and guide you through and through. May you also become a healer to many more that needs it through your powerful remedies.""""To those still wondering if homeopathy really works, please learn from my experience. This testimonial is written solely based on my own experience with the healing power of homeopathy and most importantly the right doctor.""-Ridhima', 'I recommend the doctorHappy with: Treatment satisfactionDoctor friendlinessExplanation of the health issueValue for moneyWait timeI was suffering from throat infection. I was initially taking allopathic treatment but the problem was recurring and even antibiotics were not curing the infection . Tired, I decided to try homeopathic treatment. After taking the treatment, the effect was fast. This was contrary to the effects of homeopathic treatment, ** ***** *** ****** ** **** ***** Dr Bareja explained that he administers classical homeopathic treatment in which the effect is fast. I am better now and want to recommend homeopathy to others also.Thanks a lot Dr Bareja !!!', 'Visited For Allergic Rhinitischild careI recommend the doctorHappy with: Doctor friendlinessExplanation of the health issueTreatment satisfactionValue for moneyWait timeDr Chandervansh is a fantastic doctor. My kid was suffering from frequent cold and cough since a long time due to pollution in Delhi. I consulted Dr Chandervansh for his treatment and got fantastic results. My kids immunity has improved a lot since then.', 'I recommend the doctorHappy with: Doctor friendlinessExplanation of the health issueTreatment satisfactionValue for moneyWait timeI got to know about Dr Chander Vansh from my friend...His wife was taking treatment from Dr Chander...then i decided to give a try to homeopathy and met Dr Chander for my allergic asthma problem..he listened my problem carefully and started the treatment....Now...My allergic asthma is under control with his treatment...Thanks Dr Chander Vansh and Homeopathy', ""I recommend the doctorHappy with: Doctor friendlinessExplanation of the health issueTreatment satisfactionValue for moneyBeing a fresher homoeopath i had several questions to which he was and has been very patient to answer he always explains n prescribes very patiently n tries to explain everything .His treatment has been very supportive in my father's case. His medication has helped my father so so much in swallowing in weakness and painI'm thankful to him and will always be.""]"

37,Dr. Jigyasa Wadhwa,"BHMS, MD - Homeopathy","AYUSHHomoeopath
12 Years Experience Overall","E-15/29, 1st Floor, Mandir Marg, Landmark: Opposite Aap Ki Rasoi Restaurant, Delhi","Mon - Wed, Fri - Sun",10:00 AM - 05:00 PM,95% (44 votes),₹1000,https://www.practo.com/delhi/doctor/dr-jigyasha-wadhwa-homeopath?practice_id=1118873&specialization=Homoeopath&referrer=doctor_listing,"['Visited For Skin Disease TreatmentI recommend the doctorHappy with: Doctor friendlinessExplanation of the health issueTreatment satisfactionValue for money****** *** ** *** **** *********** ****** **** * **** **** *** *** i will also recommend others to definitely visit their clinic because its worthwhile.', 'Visited For Joint Pain TreatmentI recommend the doctorHappy with: Doctor friendlinessExplanation of the health issueValue for moneyA doctor is considered as efficient in curing the disease and Dr. Dheeraj & Jigayasa both are very friendly and spend a substantial time with the patients to understand not only their physical pain but emotional angle as well.Their medication process is slow but highly effective in the long run to get rid of the pain/problem permanently.', 'I recommend the doctorHappy with: Doctor friendlinessExplanation of the health issueDoctor is easily available on phone. Listens very patiently. Make us stress free. Explains things as such that a layman can understand. Definitely recommendable. Very satisfied to be in touch of such doctor.', 'Visited For Cough TreatmentI do not recommend the doctorHoped for better: Explanation of the health issueDoctor friendlinessWait timeTreatment satisfactionI am not at all satisfied .She has not explained me anything &has not given me the time too.My appointment time was 1:30 but she was busy somewhere else.My experience is not good & I have wasted my money .', 'Visited For Eczema TreatmentSkin Allergy TreatmentI recommend the doctorHappy with: Doctor friendlinessExplanation of the health issueTreatment satisfactionValue for moneyMy son Shaurya(11yrs) was suffering from severe eczema.. Thanks to Dr. Dheeraj Wadhwa for his proper explanation of disease, friendliness and treatment..', 'I recommend the doctorHappy with: Doctor friendlinessExplanation of the health issueDoctor is really sweet in nature. One can easily tell her problem to a doctor without any hesitation. She listen problem with patience and provides medicine n tips.this is my second time visit to a doctor with hope that my daughter n I will completely cure in future. Hoping for the best.', 'I recommend the doctorHappy with: Doctor friendlinessExplanation of the health issueTreatment satisfactionWait timeI came to dr jigysa in 2017 . I was very disappointed wd inability to conceive. My fallopian tubes was blocked. I was advised iui by gynaecologists. Dr Jigyasa assured me dat i vl conceive wd homoeopathy nd it happened on 22 sept 18 _i was blessed wd baby boyThnx a lot dr jigyasa dr dheeraj wadhwa😘🥰', ""Visited For Infertility Evaluation / TreatmentI recommend the doctorHappy with: Doctor friendlinessExplanation of the health issueTreatment satisfactionI am very satisfied with the treatment and Jigyasa Mam's way of talking with the patient...she listens the problem very carefully and treats them."", ""Visited For Uterine Fibroid TreatmentHigh Blood PressureI recommend the doctorHappy with: Doctor friendlinessExplanation of the health issueTreatment satisfactionValue for moneyWait timeI have complete faith in both the doctors. I'm leading a healthy and stress free life now. Both of them are our family doctors now."", 'I recommend the doctorHappy with: Doctor friendlinessExplanation of the health issueTreatment satisfactionValue for moneyWait timeDr Jigyasa is very nice in xplaining my disease.Very happy wd d attitude of doctorAmbiance of clinic is divineStaff is not so polite.']"

38,Dr. Vishwajeet Singh,Doctor of Homeopathic Medicine (HMD),"AYUSHSexologist, Homoeopath, Sexologist (Homeopathy)
10 Years Experience Overall  (9 years as specialist)","#A-264, Landmark: Near Metro Pillar 760, Delhi",Mon - Sat,10:00 AM - 08:00 PM,,₹600,https://www.practo.com/delhi/doctor/vishwajeet-singh-homeopath?practice_id=811022&specialization=Homoeopath&referrer=doctor_listing,"['I recommend the doctorSuch an amazing experience , *** ****** ** **** ************* *** you will just talk to him and it feel so relaxing with his AdvisesThumbs up', 'I recommend the doctorHe is an Amazing Doctor and a Very dynamic human beingHe is always full of energy and motivation , he always give best advise and let you feel very comfortable', 'I recommend the doctorI was having many many confusions about online consultation , but I had an very amazing experience with doctor Vishwjit Singh , he talked very nicely and gave me many polite advicesI am very happy with his treatment ... thank you sir']"

39,Dr. Yogesh Sehgal,DHMS (Diploma in Homeopathic Medicine and Surgery),"AYUSHHomoeopath
30 Years Experience Overall","19A, Pocket A, Landmark: Near MTNL Exchange, Delhi",Mon - Fri,06:30 PM - 09:00 PM,,₹1700,https://www.practo.com/delhi/doctor/yogesh-sehgal-homeopath?practice_id=1142741&specialization=Homoeopath&referrer=doctor_listing,"['I recommend the doctorFirsr of all I must say Dr Sehgal is undoubtedly a great human being and very focused through personal.He cured my wife who had severely suffered from contractions in her small intestine since more than 10 years.I had a lot of acidic issue and my immune system was too weak which got cured within 2 years and I had stopped taking Pan Top D tablets which I was having since last 9 years.** ****** ** **** * *** ** ** *** I would strongly recommend all of you to see him for any kind of illness you may have or even for normal well being for your life.', 'I recommend the doctorIndia is lucky to have a doctor like Vedant Sehgal and Yogesh Sehgal. After consultation, I felt I would be taken care of *** ** ** *** ***** ** *** ** *** **** *********** The way they take care of their patients is extraordinary. Thank you so much doctor.', ""I recommend the doctorA very confident doctor **** ** ***** ********* ** *** ******** He possesses a quality which not many doctors have that is, he comes down to the patients level to explain him or her in a layman's language about the disease the patient is suffering from. His optimistic approach helps the patient in winning half the battle"", 'I recommend the doctorWell, it is not about his friendliness but his ability to understand the problems we are facing and provide right medecine.We rely completely on him for any of the health related issues in our family.', 'I recommend the doctorImmediate relief from disease & good care he go through full detail and listen carefully about disease he ask how & when the problem started']"

40,Dr. Geeta Rani Arora,BHMS,"AYUSHHomoeopath
18 Years Experience Overall","K-30B, Basement Kalkaji, Landmark: Opp. Balaji Estate, Delhi, Landmark: Opposite Balaji Estate , Delhi",Mon - Sat,10:30 AM - 02:00 PM,,₹1000,https://www.practo.com/delhi/doctor/dr-geeta-rani-arora-homeopath-1?practice_id=879637&specialization=Homoeopath&referrer=doctor_listing,"['I recommend the doctori took treatment for my mother and it helped her tremendously ,dr geeta also advised remedy for my sister. Chillblains which also was so helpful']"

41,Dr. Priyanka Sharma,BHMS,"AYUSHHomoeopath
16 Years Experience Overall","44A/14, GH-2, Ankur Apartments, Paschim Vihar, Landmark: Neo Convent School, Delhi",Mon - Sat,"11:00 AM - 01:00 PM
06:00 PM - 08:00 PM",,₹300,https://www.practo.com/delhi/doctor/priyanka-sharma-1-homeopath?practice_id=794252&specialization=Homoeopath&referrer=doctor_listing,['I recommend the doctorhad a very comforting experience with Dr. Priyanka Sharma for my lichen skin problem wherein allopaths has recommended.steroids as they have no other.option but in just 4 months I am cured totally.Dr. Priyanka Sharma repliedThank u Rahul for the appreciation...']

