,name,qualification,specialization,clinic_address,timing_days,timing_session,review_score,consultation_fee,current_url,feedbacks
0,Dr. P.R. Krishnan,"MBBS, MD - General Medicine, DM - Neurology, DNB - Neurology","Neurologist
29 Years Experience Overall  (20 years as specialist)","154/9, Landmark: Opposite IIM-B, Bangalore",Mon - Sat,12:30 PM - 03:00 PM,89% (229 votes),₹900,https://www.practo.com/bangalore/doctor/dr-p-r-krishnan?practice_id=1136311&specialization=Neurologist&referrer=doctor_listing,"['Visited For Dementia TreatmentI recommend the doctorHappy with: Doctor friendlinessExplanation of the health issueTreatment satisfactionValue for moneyWait timePretty clear in explanation, no over testing and only required medicines. Recommended for sure for age related issues', ""I recommend the doctorHappy with: Doctor friendlinessExplanation of the health issueTreatment satisfactionValue for moneyWait timeTwo months into our marriage, my spouse, who is 29 years old, complained of a headache and haziness in front of his eyes. As I was new to Bangalore, I looked up online for a good neurologist and found Dr. Krishnan's address. He suggested an MRI to eliminate all extreme possibilities. Because my spouse is claustrophobic, we requested him for an alternative, but he insisted on it. And I can't be thankful enough to him for this. Through the MRI, we found out that what we had been dismissing as a migraine, at the most, turned out to be a blood clot in the watershed region of the brain. In short, my spouse had suffered a minor brain stroke. The moment I got to know this, I called up Dr. Krishnan. We fixed an appointment with him, and he patiently explained everything to us. Further, he made sure that we went for the relevant tests to find out the cause behind it, even though he was able to guess that it was B12 deficiency. In the meanwhile, he put my spouse on medicines to gradually dissolve the clot and prevent any recurrence. The test results were able to eliminate many possible causes and indicated that the stroke was probably induced by a B12 deficiency only. He immediately prescribed him B12 injections and asked us to make some lifestyle changes.A brain stroke is not something that one hears of often, so you can imagine how panicked and scared we were when we found out about it. But we are so lucky that we have had Dr. Krishnan's guidance and expertise with us every step of the way. He has been so patient, friendly and prompt throughout. I can't thank him enough for this.It has been almost a year since the stroke, and by God's grace, my spouse is doing fine. As is usual after a stroke, he is still on a blood thinner and some preventive medicines, but these don't affect his normal life functioning in any way.I super-recommend Dr. Krishnan, and hope that my story gives hope to anyone who is reading it. :)Dr. P.R. Krishnan repliedI have no words to express my thanks for taking time to write such a detailed feedback. Glad that he is doing well."", 'Visited For Nerve and Muscle DisordersI recommend the doctor** ** *** **** ****** you can go to for your problems. He does not scare you unnecessarily and gives more natural treatments. Amazing doctor.', ""Video consultation done For Stroke TreatmentI do not recommend the doctorHoped for better: Explanation of the health issueTreatment satisfactionIt was utter misuse of time.. doctor being available for online consultation coming on phone and saying without seeing patient can't suggest anything.. he did not even do video call .** ***** ******* * ***** *********** **** *** * ***** **** *** ********* ******* ****** ** ********** ******** ********** **** ********"", 'Visited For Headache ManagementI do not recommend the doctorHoped for better: Explanation of the health issueTreatment satisfactionThe clinic is very near and easily accessible and i thought wow and there is very less wait time unlike other doctors. I used to get headache three times a month and that used to be severe after my pregnancy so i came to this doctor for checkup. He suggested some tablets and told migrane and wrote brain MRI. Told us MRI but when we went to the scan center they told spine MRI angiogram for heart. Im not sure why was that required. At least doctor should tell us why he is prescribing the tests and what is the link for the headaches. After showing the scan report didnt even explain took the picture of the scan and was sending it to the diagnostic as he suggested it to gain some money out of it. Now he told there no issue in MRI and go to eye doctor orelse you may loose your vision i asked could you please repeat he said if i repeat 100 times its the same i think thats not the way he. Talk to the patients. Explain the problems to the patients first clearly after going to ophthalmologist may be he will take a picture and gain out out it i guess. ** ** ********* **** ***** ******* ** **** *** **** ******** ***** **** **** Dont do this try to explain the problem to patients out of concern they are going through so much already adj seeking your help', 'Visited For Neurological ProblemsI recommend the doctorHappy with: Doctor friendlinessExplanation of the health issueTreatment satisfactionValue for moneyWait timeLast few years I had severe cramps in both the legs and loss of sensation in the fingers on right foot besides several other problems and the treatment got from few doctors was unsatisfactory. By chance I met Dr Krishnan in Nano hospital and started taking treatment from him sometime from the year 2018 and since then I am under his treatment for all my ailments . Considering my age (77 years), I would say that most of my problems have been treated to my fullest comfort level and medications were also minimum. Wherever it is necessary, without hesitation he refers the patients to specialists of specific diseases. He is easily available on phone on emergencies and treat you with online consultation if the diseases are explained properly. As a patient I get mental comfort when I approach him for my ailments.', ""Visited For Nerve and Muscle DisordersI recommend the doctorHappy with: Doctor friendlinessExplanation of the health issueTreatment satisfactionValue for moneyDr. Krishnan is very patient,supportive and friendly.I have been suffering with fibromyalgia for past 4 years. initially I have consulted so many Orthopedicians and Neurologists but none of them could give definite solution. So I kept searching and then I found about Dr. Krishnan online. On my first visit he suggested blood work to confirm my condition. Since then I'm getting treatment from Dr. Krishnan. He doesn't scare you or prescribe unnecessary tests or medications. He's been very supportive and very patient and listens to all my problems. Because for a patient it is very important to be heard.Dr. P.R. Krishnan repliedThank you very much. Your good words encourage me to stretch the extra mile despite my age."", ""I recommend the doctorWe have been taking treatment from Dr Krishnan for my mother's balance related problems. My mother suddenly started losing balance while walking, feeling diziness in last January. Initial treatment from local doctor in my town didn't help. So we brought her to Bangalore and consulted Dr Krishnan at Fortis hospital. Her condition improved within couple of weeks and she was able to carry out her daily activities as usual.Unlike few doctors I encountered who burden the patient with several costly tests right at the beginning, Dr Krishnan took a step by step approach for diagnosing the problem. He started with simple doses of medication, kept reviewing the progress on regular basis , ordered additional tests as and when needed and kept changing medication when needed. He is patient enough to answer any queries we may have.I recommend Dr Krishnan for any balance related problems, parkinsonism."", 'I do not recommend the doctorHoped for better: Doctor friendlinessExplanation of the health issueTreatment satisfactionValue for moneyWait timeDoctor - PR Krishnan - My mother was suffering from hypertension and since two days she got dizziness while sleeping, nausea, vomiting sensation, left arm was paining. We met this super busy doctor for 10 mins ***** ** ****** *** ******** ************ **** ********* ****** *** asked to do - Blood test and head scan. We came out to check for blood test, nano consultants asked to wait for 15 mins. They called the doctor to check about it as nothing was mentioned on prescription. Also, he was in hurry n left already. He denied for any tests and informed them that everything was fine. Doctors who charge RS 600 for just 10 mins without complete information should be worshipped. **** ******** * ****** If you love your life never visit Nano hospital. **** **** ******* *** ******** ** ******* ******* ******** ****** ** *** **** **** ** ***** ** **** *** ****** ** ****** * ****** ******** ** **** **** *** *** ********** ** ***** **** **** *********Dr. P.R. Krishnan repliedEverything was written and explained also. I had given medicines and told you that we will do investigations if there is no improvement. I think you misunderstood after asking the receptionist. If there was any doubt you could have directly contacted me.', ""I do not recommend the doctorVisited the doctor for an involuntary stomach muscle contraction otherwise known as a tic. He is very friendly and patient. Told him all my symptoms. He checked my BP and it showed 132/116 which is high. He prescribed me a tablet to lower my BP. Asked me to get my brain scan done and another test and come back to him. Meanwhile he would analyze if this medication is working. I left and contacted another doctor since my BP was abnormally high. Upon checking, my BP was 120/80 which is a normal range. He was surprised as to how a person can prescribe low BP tablets without checking twice when I don't have a high BP history. Within an hour I went to another place and got my BP checked which also showed normal. If not for a second opinion, I'd have ended up taking meds to lower my BP despite having a normal range.""]"
1,Dr. Ravishankar Reddy C. R.,"MBBS, MD - General Medicine, DNB - Neurology","Neurologist, General Physician
29 Years Experience Overall  (14 years as specialist)","Number 153,1st Cross, Landmark: Near Jakkasandra Bus Stop and Beside Bandhan Bank, Bangalore",Mon - Sat,12:30 PM - 03:30 PM,88% (924 votes),₹1000,https://www.practo.com/bangalore/doctor/dr-ravishankar-reddy-c-r-diabetologist?practice_id=659126&specialization=Neurologist&referrer=doctor_listing,"['Visited For Vaccination/ ImmunizationI recommend the doctorHappy with: Doctor friendlinessExplanation of the health issueTreatment satisfactionIt was highly professional and good treatement.I was well taken care of and right medicine prescribed.', 'Visited For Numbness and tinglingI recommend the doctorHappy with: Doctor friendlinessExplanation of the health issueTreatment satisfactionTO ME RAVISHANKAR SIR IS GENIUS AND A GOOD HUMAN BEING AS WELL.RESOLVES EVERY PROBLEMS SO SIMPLY AND GIVES VERY LESS MEDICINES AS COMPARED TO OTHER DOCTORS.', 'Visited For Nerve and Muscle DisordersI do not recommend the doctorHoped for better: Explanation of the health issueTreatment satisfactionWait timeHave seen the doctor twice so far.1. First visit, had to wait for atleast 45 mins before I could see the doc. Registration and advance booking is a joke here, receptionists note everything in a register and keep mixing up the appointments. There were 2 patients with the same timing.The doc was friendly and listened patiently to our problems2. Second visit - Appointment issue continue to exist. However, this time, our experience with the doctor was really bad. The only word which comes to my mind is unprofessional, while we were trying to narrate our problems, he was busy scrolling his phone and kept on receiving calls. He also dialled a number and then said, I got a call from this number so let me check. The call was a sales call, and to our surprise he continued speaking to the sales person over call enquiring about some scheme.All this while, we kept our calm and continue when he disconnected the call. Despite the file being in front of him, it seemed as if he had no idea about what was going on and then he narrated some diagnosis which was complete opposite of what he said in first visit. When I reminded him of that, he tried to come up wit an answer but then later said, can’t really say anything right now and told us to consult the physiotherapist.Please avoid him at all costs.', ""Visited For Headache ManagementDizzinessI do not recommend the doctorThere are lot to highlight here:1) They don't have any proper system for allowing patients. i booked slot with doctor 12.30 pm but staff didn't allow us till 1.30. Practo fails in this.2) This is my second time visit for headache, **** *** ** ****** ********** ***** ******** ** ******* **** he is not guiding us properly.3) More than patient he will communicate more in mobile rather than speaking with patient. DR Seeking help from nurse while guiding tablets, this is highlight :(this is my last visit with him, better go with other doctor.DON'T WASTE TIME AND MONEY."", 'I recommend the doctorHappy with: Doctor friendlinessWait timeI was going through then reviews while waiting for the doctor. The concerns that have been mentioned about being unprofessional and having to respect towards people time is very true. I was too late to see the reviews. After 40 mins of waiting, when I was finally blessed to meet him. I was greeted with arrogance and that looking mobile and talking really gets on your nerves. Highly unprofessional and has no respect towards others. He asked the nurse to take me to another doctor and come back to me later which I am glad he did as he met a decent human being when it was done apparently doctor had left somewhere and I was not ready for a waiting game so I left. Unfortunately some people really misuse their authority.', 'Visited For Stomach pain and stomach upsetFood PoisoningI recommend the doctorHappy with: Doctor friendlinessExplanation of the health issueTreatment satisfactionValue for moneyI suffered from acute stomach pain, loose motion and slight fever. After viewing good reviews, booked appointment. I though it was stomach infection. I am satisfied with treatment because he exhausted various cases before concluding that it was food poisoning. Thank you Doctor.Just one advice: call before and confirm your appointment.Pros:Full checkup : Stomach, BP, pulseCareful ListeningMinimum and affordable medicineExplanation of causeCons:Long wait. I have to wait for 1.5 hours even after booking appointment, they send one from practo appointment and one from the first-come-first list prepared at hospital. So call before and confirm your appointment.', 'I do not recommend the doctorWe had visited for my fiancé as she had a sore throat. The doctor was more interested in her nationality and hearing impairment than in the actual symptoms. Nurses kept walking in and out of the room and disturbing the conversation. He did not even listen to one thing we said properly. ** **** ** ****** **** **** **** * ******* *** *** *** ******* ** *** * *********** *** **** ** ******* ****** ** ** ******* **** ****** *** ***** *** ******* ********.I would not recommend wasting time and money on him.', 'Visited For FeverI do not recommend the doctorHoped for better: Explanation of the health issueI was suffering from Fever and Visited doctor few months back* * *** ********* ** *** ****** ******. he created seriousness and asked me to admit. i was having normal fever and all my reports are clear. later i went to other clinic and took treatment. i recovered in 48 hours. Other clinic doctor said i have normal fever and normal fever medicine is good enough. and he also suggested in case if fever wont come down he will suggest antibiotics. I request Mr. Ravishankar to be honest with patients. we come with of of trsut.', 'Visited For Fungal InfectionI recommend the doctorHi Guys,Its good to give honest feedback. I feel to share with you guys about our experience. I was affected with Aprus virus and a massive pain started at my back and I felt very worried about my disease. My elder brother found DR.Ravishankar Sir and we consult with him.whenever if we got any disease then most importantly it should get diagnosed properly. Believe me Doctor catches in his first glance about the virus affected to me. He is really a cool attitude and worthy person as I felt after his treatment. I recommend him .Thanks for your help Sir.. Really Appreciate the way you diagnosed. Thanks again', ""Visited For HeadacheI recommend the doctorMy experience with Dr. Reddy was very good. It was his medication which eventually brought my Migraine almost down to zero in a span of 4 months. He listens to patient's problems and explanations carefully and gives attention to details. Does not jump to conclusions immediately. The best part is he does not recommend tests right away unlike most o the doctors now a days. In my case, I was recommended an EMG MRI scan by a different doctor for the same condition when the medication did not work. I would hate ghly recommend Dr. Reddy for anyone.""]"
2,Dr. Lokesh B,"MBBS, MD - General Medicine, DM - Neurology","Neurologist
25 Years Experience Overall  (18 years as specialist)","No. 43/2, New Airport Road, NH.7, Hebbal, Sahakara Nagar, Landmark: Opposite Godrej Apartments, Bangalore",Mon - Sat,11:00 AM - 04:00 PM,88% (24 votes),₹900,https://www.practo.com/bangalore/doctor/dr-lokesh-b-neurologist?practice_id=1146253&specialization=Neurologist&referrer=doctor_listing,"['I recommend the doctorConsultation experience was good overall, visited for my brother for so some nerve problem, happy with the explanation of health issue given by the doctor, one thing can be improved is when we visited him he was referring us to other doctors in the same hospital he is an experienced doctor but referring to other doctors how many doctors he referred we had to pay them consultation fees everyone doctor waste of money, when I visited him and said I have minor back pain he referred me to general physician said he is not the right person to see. Each doctor consultation fees is different if he couldn’t see he wouldn’t have taken the money unnecessarily charging the consultation fees,doctors behavior was good Overall good', 'I recommend the doctorI had visited the hospital and it was hand pain. Consultation was fine by the doctor. I can definitely recommend the doctor to my family or friends. Tests was done and it was normal. There was no waiting time in the hospital. Doctor was friendly and I knew doctor since long time.', 'I recommend the doctorhe is a man of few words but can surely be the best advisor .. he along with his team of anuradha, Dr kaiser raja, sonal, mallikarjuan rajeev, ravish i r have given me a second lease of life.. what a wonderful team they are.. lokesh was cool and kept my family members positive thinking when I had a remote chance of survival..', ""I do not recommend the doctorHoped for better: Explanation of the health issueWe consulted Dr as per suggestion of other doctor. didn't provide any solution for the pain which patient is going through as the pain was intolerable and patient was in tears. Suggestion was to consult the doctor to whom I've already consulted sometime back. Patient's are simply running around the bush wasting their time and money *** ** ******** ******* ** ***** ** **** ***** ***** *** ***** ********* ** ****We need to visit new doctor in coming days to find out what really is happening."", 'I recommend the doctor** ** ********* ** ********** very patient ly listening and advising appropriately. right guidance at right time.', ""Visited For Headache ManagementI recommend the doctorHappy with: Explanation of the health issueDoctor Lokesg is very good,makes you feel comfortable and finds solution for your problem.As he's our regular doctor. We are very happy with his treatment.Thank you doctor. We really appreciate you for treating patients during vivid.""]"
3,Dr. Guruprasad Hosurkar,"MBBS, MD - General Medicine, DNB - Neurology","Neurologist
18 Years Experience Overall","26/4, Brigade Gateway, Malleshwaram West, Landmark: Beside Metro Cash and Carry West, Bangalore",Mon - Fri,"11:00 AM - 01:30 PM
05:30 PM - 06:30 PM",88% (16 votes),₹950,https://www.practo.com/bangalore/doctor/dr-guruprasad-hosurkar-neurologist-210357?practice_id=1131812&specialization=Neurologist&referrer=doctor_listing,"[""I recommend the doctorWe always wait for nearly 2 hours or more than the given appointment time. It's pathetic...the hospital should be more organised"", 'Visited For Neurological ProblemsI recommend the doctorHappy with: Doctor friendlinessExplanation of the health issueTreatment satisfaction** ** * **** ************* *** disease root cause analyst doctor. He listens patiently and diagnose and advise as per the problem/disease. ********* ****** **** good command of Hindi as well.', 'I do not recommend the doctorHe simply asks the patient to come for visits and does not explain root cause.I am not very happy with the doctor.', 'Visited For HeadacheI do not recommend the doctorDoctor never listens to you, when visited for heavy migraine pain he stated it is pain you have to bear it. most impatient I would never recommend to anybody.', ""Visited For Parkinson's Disease TreatmentI recommend the doctorHappy with: Doctor friendlinessExplanation of the health issueValue for moneyVery competent and empathetic and reassuring. Seems to have given the correct diagnosis.Treatment just started."", 'I recommend the doctorHappy with: Doctor friendlinessExplanation of the health issueTreatment satisfactionValue for money************* *** *** very pleasant . Heard the problem with patience. Clinically examined my hisband.Definitely would recommend him.He could identify the nerve problem in the leg and sugested medicines and exercises.']"
