,name,qualification,specialization,clinic_address,timing_days,timing_session,review_score,consultation_fee,current_url,feedbacks17,Dr. Prashanth L K,"MBBS, DM - Neurology","Neurologist
21 Years Experience Overall  (14 years as specialist)","71/1, Vasanth Nagar, Landmark: Opposite to St Annes College & Beside Navnit Motors, Bangalore",Mon - Sat,08:30 AM - 03:00 PM,72% (29 votes),₹1450,https://www.practo.com/bangalore/doctor/dr-prashanth-neurologist-3?practice_id=634957&specialization=Neurologist&referrer=doctor_listing,"[""Visited For Parkinson's Disease TreatmentI recommend the doctorGone through our 2 years old medical records, asked us about present problems , gave simple tips, to improve low BP.He was listening to patient's health issues with patience & recomended how to improve physical condition.We will meet him again after 6 weeks .Thank you Doctor ."", 'Visited For Neurological ProblemsI recommend the doctorHappy with: Doctor friendlinessExplanation of the health issueTreatment satisfactionDr. Prashanth was referred by our local home town doctor for treatment related to neurology for my father. We had to travel 7 hours to meet Dr at Apollo Hospitals,sheshadripuram.Prashanth is not just a doctor but with real zeal to help and cure patients. After meeting prashanth, we were briefed about the issue, and he gave us analysis and how he wanted to treat step by step. He also motivated and gave us a positive feedback which relaxed my worried parents.His approach of analysis and way of treatment, patience towards patients is appreciable. Thanks to Prashanth for all the support.Thanks and Regards,Kiran Sakaray', 'I do not recommend the doctorHoped for better: Doctor friendlinessTreatment satisfactionValue for moneyWait timeHad a worse experience at the hospital when I had taken my Dad for a hemifacial Spasm treatment. The doctor lacked human touch. ** **** *** ********* **** **** ***** *** ***** **** ** ******** ****** **** ***** They made us buy the serum used for the treatment with costs around 13k *** **** **** **** **** ** ** *** ** ***** ********* *** *** ********* **** *** ****** ****** **** *** *** ******** ** *** ******* ****** ** **** *** ** *** ***** ******** ** *** **** ******** *** **** ***** ** **** ****Parking is even more bad they collect more than the shopping malls. ***** ** ***** **** ******** ** *** ******** * no value for your time they will make u wait *** * ***** ****** for a consultation though u have an appointment at the fixed time.', ""I do not recommend the doctorHoped for better: Doctor friendlinessExplanation of the health issueTreatment satisfactionValue for moneyWait timeBetter avoid him... He will argue with you ** ********* ** ************ ****** ****** **** ******** *** ************* *** ******* *** ************** ********* ** *** ********** ** **** *** **** ****** ****** ** ********** **** ******* ** ******* *** *** **** ********** *** need to have some patience *** ****** *** ********* ** *** * ********* **** But I guarantee you dat at the end of the day u will be satisfied and you would save a hefty amount too. The table tilt test which is done in Vikram hospital is costly which costs you 5k and the reports are not clear. My dad got a total false report and we did it again ** ******** The reports here and there have so much difference. *** ** *** *** * ******* **** ******* *** **** ** ******** ********* ********* So it's up to you and this is my honest review.I wish all the citizens of India *** * ******* ********* ** *** ******* ******* health is wealth and nothing can substitute it. Nothing!"", ""I recommend the doctorConsultation experience was good with the doctor visited for some neurological issue, I am happy with the doctor's explanation, the doctor was very good in behaviour he is so friendly. Definitely, I'll recommend the doctor to my friends and family. This is the first time I am consulting this doctor, hospital facilities we have only utilized the OPD consultation, waiting time was about to 30 to 45 minutes after taking the appointment also we need to wait there it happens. Staff and nursing were very cordial and very helpful."", 'Visited For Deep Brain StimulationI do not recommend the doctorHoped for better: Doctor friendlinessExplanation of the health issueTreatment satisfactionValue for moneyWait time** ****** ****** **** **** **** ******* ** **** *******During check up means before surgery he talk very nicely with the patient once patient admitted he will not at all bother about the patient. Last year DBS done for my mother after surgery he not at all bother about my mother health ** ***** ****** ** **** *** after surgery he behaved very rudely with us,he not at all responded to our mother health.', ""Visited For Movement DisorderI do not recommend the doctorHoped for better: Explanation of the health issueTreatment satisfactionValue for moneyWait timeI have visited dr.prashanth at Vikram for my mom's Parkinson disease, * ******* ********** ** ******** ***** My colleague refered him..so went for one more advice..he said its not Parkinson. He asked us to go for many tests which costed us 42000. All test came negative. He asked in turn what should we do now? And finally ended up giving same medicines which were given by ******** **** doctors. Look there are middle class people as well..spending so much *** ** ****** ***********it hurts very badly. By seeing reviews we come with lots of hopes. Please do justice to your work.Kindly give true real experience reviews..it will be really helpful."", ""Visited For Parkinson's DiseaseI recommend the doctorHappy with: Doctor friendlinessExplanation of the health issueTreatment satisfactionHas lot of patience. Very friendly. His smile is the medicine for patients. Thank you so much Sir. ** ********* * * *** ** **** * **** *** ****** **** *** ***"", ""I do not recommend the doctorI visited and checked up all thing, the experience was very good with the doctor. Treatment is like not satisfied. Once like he is saying as there is no solution for your diseases. At least he has to give a suggestion. He didn''t say anything he just said your nerves are blocked but there is a solution he did not give any suggestion. He did all every test have done still my fingers are numbness still I am getting the problem. He was not able to find my problem, he was listening to my problems but he said the same thing your nervous is blocked but he should give some solution. He could have suggested some treatment is surgery, he said us we cant to do anything this is the final and once and all he said that all nervous is burnt, what does it mean burnt? There is no treatment in the world. He did not explain the problems completely, this is the first time I visited to him."", ""Visited For Parkinson's Disease TreatmentI do not recommend the doctorHoped for better: Doctor friendlinessExplanation of the health issueTreatment satisfactionValue for money*** **** ******** ******* prescribes medicine without even reading report and charges a hefty sum for that.when I discussed my issue with him- instead of treating the disease he is in turn questioning me as to what can be done.good thing I cam home and read about the medicines he prescribed. would have led to a critical condition if I had taken the medicines.""]"
18,Dr. Anil.R,"MBBS, MD - General Medicine, DM - Neurology","Neurologist
20 Years Experience Overall  (8 years as specialist)","Kirloskar Business Park, Bellary Road, Landmark: Opposite Dairy Form & Near Esteem Mall, Bangalore","Mon - Wed, Fri - Sat",09:00 AM - 01:00 PM,,₹800,https://www.practo.com/bangalore/doctor/dr-anil-ramakrishna-neurologist?practice_id=637575&specialization=Neurologist&referrer=doctor_listing,"[""Visited For Nerve and Muscle DisordersI recommend the doctorHe is very good Doctor ..... very Good receiving very good treatment and allso very friendly nature I'm very happy feeling on the Treatment"", 'Visited For Nerve and Muscle DisordersI recommend the doctorHappy with: Explanation of the health issueReally superb doctor the way he received us was really excellentMoreover he gives confidence to patient which can’t be built us as children of the patient who got treated by himI recommend to all to meet this doctor']"
19,Dr. Amit Kulkarni,"MBBS, MD - General Medicine, DM - Neurology","Neurologist
18 Years Experience Overall  (9 years as specialist)","Number- 8, Ideal Homes Township, HBCS Layout, Landmark: Opposite to Icon Internation School, Bangalore",Mon - Sat,10:30 AM - 01:00 PM,88% (33 votes),₹700,https://www.practo.com/bangalore/doctor/dr-amit-kulkarni-1-neurologist?practice_id=1168814&specialization=Neurologist&referrer=doctor_listing,"['Visited For Neurological ProblemsI recommend the doctorI highly recommend the doctor , i visited for my mother related to neuro problem , he is patient ,listen to all the concern and excellent treatment', 'I recommend the doctorI visited for fibromyalgia with severe pain all over and anxiety issue, doctor was listening to everything I told , he started with the treatment after checking me up through my which is working for me , he also suggested for some life style changes also asked me to come back after 20days to know my condition. Thank you Doctor * *** *** ****', 'Visited For Stroke TreatmentI recommend the doctorHappy with: Doctor friendlinessExplanation of the health issueValue for moneyWait timeFollow up on stroke treatment visit. Doctor had a thorough examination and helped us to root cause the issue which helps greatly to avoid future issues. Doc was patient enough to answer our queries which is hardly seen elsewhere.Highly Recommend the Doctor', 'Visited For Nerve and Muscle DisordersI do not recommend the doctorHoped for better: Treatment satisfactionWait timeHospital is good for icon place but Lot of waiting period for doctors consultation, treatment satisfied but lot of waiting period for consultation after taking appointments', 'Visited For Stroke TreatmentI recommend the doctorHappy with: Treatment satisfactionDoctor friendlinessComing for the follow up check after a period of one year Dr.Amit Kulkarni was well aware about the patient’s history is really touching & appreciating the-efforts of others like the physio is really great of him.', 'Visited For Neurological ProblemsI recommend the doctorHappy with: Treatment satisfactionI would like to emphasise that it was a pleasure interacting with Dr. KULKARNI Aunder his treatment. He would always give a patient hearing and underestimate the problem before initiating treatment.', 'Visited For Neurological ProblemsI recommend the doctorHappy with: Doctor friendlinessExplanation of the health issueTreatment satisfactionValue for moneyWait timeExplained my problem well and understood it and happy with the way it was. Happy to get a Dr like him', ""Visited For GiddinessI recommend the doctorHappy with: Doctor friendlinessExplanation of the health issueTreatment satisfactionValue for moneyThe doctor explain me my problem and the treatment givento me is goodValue for time' treatment satisfaction"", ""Visited For Stroke TreatmentI recommend the doctorHappy with: Doctor friendlinessExplanation of the health issueTreatment satisfactionValue for moneyWait timeAn extremely satisfactory meeting with the drIt was all EARS to the patient's problemsNothing more a patient requires than a dr .giving the patient a comfort feelingCouldn't expect anything betterHighly recommendable .."", 'Visited For Neurological ProblemsI recommend the doctorHappy with: Doctor friendlinessExplanation of the health issueWait timeDoctor called out all the right symptoms and made it easy for us to understand how to solve these health issues.']"
20,Dr. B.Nataraju,"MBBS, DM - Neurology","Neurologist
47 Years Experience Overall  (29 years as specialist)","673/A, Varthur Main Road, Landmark: Near Kundanahalli Signal & Oppsite Shriram Samruddhi Apartment, Bangalore","Mon, Wed, Fri",10:00 AM - 11:00 AM,74% (27 votes),₹950,https://www.practo.com/bangalore/doctor/dr-b-nataraju-neurologist?practice_id=702709&specialization=Neurologist&referrer=doctor_listing,"['I recommend the doctorI had consulted the doctor and it was for body pain, neurology related. Consultation was fine by the doctor. I would like to recommend the doctor to other people. I am 70 percent satisfied with consultation. My issues not got resolved still. Scanning, blood test was done. There was no waiting time in the hospital when we went. I am weak and have pain.', 'I recommend the doctorMy wife had continuous head ache so went to hospital. ********* *** **** ** ******* I would like to recommend the doctor to other people. I am satisfied with the treatment given by the doctor. Tablets were prescribed by the doctor. There was no waiting time in the hospital when we went. After 20 days it got cured.', ""I do not recommend the doctorMy uncle had spinal cord related so went to hospital. Consultation was fine by the doctor. Concern is patient is getting pain in spinal cord. We took also second opinion and scanning, MRI was checked. Investigation was not proper. I am 65 percent happy with consultation. Medicine was prescribed by doctor during consultation. Surgery could be done as suggested by second opinion doctor. MRI and blood test was done. There was no waiting time in the hospital when we went. He spent a good amount of time with patient and friendly. It was not doctor fault and I don't blame on doctor."", 'Visited For Neurological ProblemsI do not recommend the doctorA patient coming from a distant state to have some good expectation fell disheartened for not to hear his troubles and remedy he gave very casual with a higher charge of fees by spending only three minutes. He is more bussy with his phone.', 'I recommend the doctorI had consulted the doctor and it was for sleep related issues and numbness. Consultation was fine by the doctor. He diagnosed well and met thrice. ******* *** *** ********* ******** ********** I would like to recommend the doctor to other people.******* ** **** **** *** experienced person. Tests were done before. Tablets were prescribed by the doctor. There was no waiting time in the hospital when we went. Doctor was friendly.', 'I recommend the doctorI had been to hospital and it was for sleep related issues. Consultation was fine by the doctor. I can surely recommend doctor to others. Tablets were prescribed by the doctor. There was no waiting time in the hospital when we went. I was not able to get proper sleep that was concern I met the doctor.', 'Visited For Neurological ProblemsI do not recommend the doctorHoped for better: Doctor friendlinessExplanation of the health issueValue for moneyTotally dissatisfied. Doctor did not even bother to see CT scan and other reports carried along. Was more focused on getting ECG/ cardio, where all latest heart reports were available. Very high charges yet no time spent on answering questions.', 'I recommend the doctorMy mother in law had visited the hospital and it was head ache related. Consultation was fine by the doctor. I would like to recommend the doctor to other people. I am satisfied with the explanation given by the doctor. Medicine was prescribed by doctor during consultation. There was waiting time in the hospital when we went. ', 'Visited For Neurological ProblemsI recommend the doctorVery good doctor with very good experience. Doctor took time to understand patient and problem he was very calm suggested only required test and with minimal medicines.', 'Visited For Neurological ProblemsI recommend the doctorA doctor who listens well before prescribing any treatment. Prescribes minimal medication and tests.']"
21,Dr. Shakthi K J S,"MBBS, MD - General Medicine, DM - Neurology","Neurologist
9 Years Experience Overall  (3 years as specialist)","#4/1, Tumkur Main Road, Yeshwantpur,, Landmark: Next to RNS Motors, Bangalore",Mon - Fri,10:00 AM - 04:00 PM,83% (12 votes),₹600,https://www.practo.com/bangalore/doctor/shakthi-k-j-s-neurologist-1?practice_id=918580&specialization=Neurologist&referrer=doctor_listing,"['Visited For Headache ManagementI recommend the doctorHappy with: Doctor friendlinessTreatment satisfaction**** ******* *** very friendly and I was satisfied with the treatment given to me. I definitely recommend her', 'Visited For Neurological ProblemsI recommend the doctorHappy with: Doctor friendlinessExplanation of the health issueTreatment satisfactionValue for moneyI had contacted docotr for neuro relwted issues. I had tried contacting many hospitals but sparsh doctors tried to go to the history and took relavant tests to understand why was there a issue with health and prescribed medicines that would suit the body. Overall happy with the detailed explanation doctor provided for the checkup and treatment.', 'I do not recommend the doctorfirst Dr is very very cordial, when I met Dr I told my health related problems, politely Dr analyzed my health related issues and asked questions and finally Dr told me to under go some tests and immediately Dr told me start medication also. ** ** ******** ** ** ** *** *** **** **** *** ****', 'Visited For Neurological ProblemsI do not recommend the doctorI had a very bad experience with this doctor. Doctor does not listen to your medical history explanation. She says just accept whatever she says. She is totally rude to her experience.She asked to perform number of tests/scans and did not even care to explain what is on the report. If asked for more details, she says take these tablets for 1 month and visit her back. I would not recommend this doctor to anyone. ABSOLOUTE NO PATIENCE. BAD EXPERIENCE. **** ***** ******Dr. Shakthi K J S repliedThanks for the feedback. On first day of your visit, the doctor has taken complete 3 generation history and family history of seizures and explained everything for almost 45mins and prescribed the medicines. On day 2 you have not even bothered to give prescribed medicine to the child and has come back asking the doctor to explain again to a different family member, wasting her time. Take care of the child.', 'I recommend the doctorHappy with: Doctor friendlinessExplanation of the health issueTreatment satisfactionValue for moneyWait timeI thank Dr.Shakthi for curing my problem, I never expected that I will become 100 percent alright after the treatment, but because of the treatment and friendly approach of Dr.Shakthi, I gained confidence and back to normal.Namaskara🙏', 'Visited For Headache ManagementI recommend the doctorMy doubts were cleared with all her explanation about my issue. Overall it was an informative and helpful visit.', 'Visited For GiddinessI recommend the doctorHappy with: Doctor friendlinessExplanation of the health issueTreatment satisfactionValue for moneyShe is so friendly and caring. The way she explained and advised is an great relief for the patient.', ""Visited For d.m-nuerologyI recommend the doctorHappy with: Doctor friendlinessDr shakthi madam is given treatment is very friendly,She explained about all health care, *** **** **** ********* *** ***** ** ******** I'm happy .Thank uRegarding,Bhagya bai"", 'I recommend the doctorI took appointment from practo app with Dr Shakthi G SThe Doctor is really good and listened to every aspect and diagnosed it appropriately.Doctor guided for MRI Scan as there is no harm using technology so to avoid further negligence.']"
22,Dr. Srinivas Raju D,"MBBS, MD - General Medicine, DM - Neurology","Neurologist
13 Years Experience Overall  (5 years as specialist)","Kirloskar Business Park, Bellary Road, Landmark: Opposite Dairy Form & Near Esteem Mall, Bangalore",Mon - Sat,02:00 PM - 05:00 PM,,₹800,https://www.practo.com/bangalore/doctor/dr-srinivas-raju-d-neurologist?practice_id=637575&specialization=Neurologist&referrer=doctor_listing,[]
23,Dr. Abdul Aziz Riyaz,"MBBS, MS - General Surgery, MCh - Neuro Surgery","Neurosurgeon, Neurologist, Spine Surgeon (Neuro)
10 Years Experience Overall  (4 years as specialist)","268, 6Th Main, 2Nd Stage BTM Mico layout , Landmark: Beside ON THE NOSE restaurant , Bangalore",Mon,"10:00 AM - 05:00 PM
07:00 PM - 09:00 PM",87% (45 votes),₹800,https://www.practo.com/bangalore/doctor/abdul-aziz-riyaz-neurosurgeon?practice_id=1247778&specialization=Neurologist&referrer=doctor_listing,"[""I recommend the doctorHappy with: Doctor friendlinessExplanation of the health issueTreatment satisfactionWait timeMy dad was treated by Dr. Abdul at Columbia Asia, Bangalore early this year. My dad was admitted in emergency on a Sunday evening and although not being on duty, Dr. Abdul was able to quickly see my dad's preliminary reports remotely *** ********* ******** the root-case and criticality of problem (every hour was counting basically). In this tough and panicking situation, doctor also appeared in hospital within hour, took excellent care not only to ensure best/fastest treatment for my father but also to soothe down my family by making us aware what was happening and answer any questions we had. During post-surgery recovery as well, Doctor went to the extent of sharing his personal contact details with me for any questions and once during an emergency case he also answered my call at 2 AM in the morning.To say the very least, he was like a family member or very-close friend to us supporting in this critical moment. I would really recommend him both for his expertise in the area and great friendliness attitude.Dr. Abdul Aziz Riyaz repliedThank u very much..."", 'Visited For SpineI recommend the doctorHappy with: Doctor friendlinessExplanation of the health issueTreatment satisfactionThanks to Dr. Abdul Aziz Riaz as he cured my sciatica problem with medication alone. Good approach towards patients with deep understanding and consultation. Was suffering with sciatica for a while and consulted many but no outcome, heartly thanks to you Sir. Good approach and excellent results. For sure will suggest you to people with such problems in future.', ""Visited For Headache ManagementI do not recommend the doctorExtreme waiting time. Doctor didn't appreciate the patients time. I had visited from a far place..."", ""I do not recommend the doctorHoped for better: Wait time** ********* **** ****** ** ******** ***** ******** **** *** ******* ***** *** **** ************* **** ******** *** ************ rooms are small and congested.had to wait for more than 45min even after taking appointment in practo.doctor was patient enough in listening to our issue and suggested to visit a neurologist (recommended a doctor's name too)"", 'Visited For Headache ManagementI do not recommend the doctorWe had to wait for more than 40 mins and the doctor was busy on the phone when we were explaining the issue. However, the tablet he suggested was helpful.', 'Visited For HeadacheI do not recommend the doctorHoped for better: Doctor friendlinessExplanation of the health issueTreatment satisfactionValue for moneyhe is asking same question again and again.** *** ****** ** **** *** **** ***** *** ** ********** ***** ** ******* *** ***** ************** * ******* **** ******** *** ** *** *** ********* ********He is asking me same questions 10 times.which irritated me a lot.my conversation only I understand that ,** ** *** ******* *** ** ********after taking his prescription,** ******* *** *******his took fee as 600/- which not worth at all.I will not prefer anyone to goto him.**** ********* ** *****', ""Visited For SpineI recommend the doctorHappy with: Wait timeValue for moneyTreatment satisfactionExplanation of the health issueDoctor friendlinessWent for consultation on my Granny's slip disc, which was causing her a lot of pain. The doc was extremely patient and friendly with my granny who's not really a fan of doctors in general. He managed to convince her to undergo surgery and she's been in great health ever since.Dr. Abdul Aziz Riyaz repliedThank your for your kind words"", 'Visited For Spinal SurgerySpine SurgeryI recommend the doctorHappy with: Doctor friendlinessExplanation of the health issueTreatment satisfactionValue for moneyWait timeThe manner by which he explained the disease condition and procedure relieved me of all my apprehensions..even though he is a reputed Neurosurgeon his attitude and behaviour makes one feel really comfortable..the fact that the clinic is easily accessible..and his availability over phone anytime through calls and WhatsApp gives a unique sense of wellness...Dr. Abdul Aziz Riyaz repliedThank u very much', 'Visited For Spinal FusionI recommend the doctorHappy with: Doctor friendlinessExplanation of the health issueTreatment satisfactionValue for moneyWait timeI have taken my mother for check up. My mother was around 60 years. She is very talkative. Doctor was very much down to earth and have patience to listen to the patient problems. He will make to us to talk and diagnose the problem to the core. He will check the patients with utmost care. I feel very happy visiting to the hospital and my mother was very much impressed the way Doctor treated us. Clinic place is quite far from our place, but still based on the Google reviews and practo reviews I have selected to visit. What ever reviews said t are 100% true. *** * ***** ******* *** ******* *** ********* ******** ** ***** ** ****** *** *** ***** **** **** ***** *** ******** *** this doctor you can Blindly trust and visit get well soon.Dr. Abdul Aziz Riyaz repliedThanks alot for your kind words....', 'Visited For Neurological ProblemsI recommend the doctorListened all my problems and explained everything clearly. we raised multiple questions but he answered with patience.']"
