,name,qualification,specialization,clinic_address,timing_days,timing_session,review_score,consultation_fee,current_url,feedbacks8,Dr. Rajesh K N,"MBBS, MD - General Medicine, DM - Neurology","Neurologist
20 Years Experience Overall","No5, JC Rd., Landmark: Near townhall, Bangalore",Mon - Sat,"10:30 AM - 02:00 PM
03:00 PM - 06:30 PM",96% (1226 votes),₹800,https://www.practo.com/bangalore/doctor/dr-rajesh-k-n-neurologist?practice_id=1276829&specialization=Neurologist&referrer=doctor_listing,"['Visited For GiddinessI recommend the doctorNice...... Treated very friendly, explanations are highly acceptable to avoid future constraints. Thank you DR. Ji...', 'I recommend the doctorVery happy with the care and help got by doctor Rajesh! Sucha gentleman and kind to have shown such care and concern! I would definitely encourage visiting Doctor for his best advise and treatment!', ""Visited For Epilepsy TreatmentI recommend the doctorThe doctor is very understanding. There's something special about the way he speaks. I am truly happy consulting the doctor."", 'Visited For Neurological ProblemsI recommend the doctorHappy with: Doctor friendlinessExplanation of the health issueTreatment satisfactionValue for moneyWait timeI had my first experience with Dr. Rajesh when my mother was diagnosed with a Spine injury. I met him to take his opinion and was very satisfied with his inputs. Very recently we consulted him for my father in laws neurological problem and very happy with the outcome. *** ****** ** *** ** *** **** ****** * **** **** ******* His Diagnosis is near perfect, explains things which a layman can understands,Never recommends unnecessary treatments and is always ready to guide you in the right direction.I highly recommend Dr. Rajesh for any neuro related issues.', 'Visited For Migraine TreatmentI recommend the doctorHappy with: Doctor friendlinessExplanation of the health issueTreatment satisfactionValue for moneyWait timeI am very glad to Dr. Rajesh KN. He has proved the wordings \'vidhyo Narayano hari\'. I have been suffering migraine from nearly 25yrs, from past 4 years it was hell. I quit my software job, I lost interest in anything. When I met Dr Rajesh I asked him only one thing give him mercy killing!!! That was the pain I suffered but today I am happily writing this message to all of you so you can make out the changes he has brought into my life. There are no words to describe my happiness today. I tried all sort of medicines. There was no Stone left unturned to get rid of my migraine. I had lost all hopes. I never thought I would be lead a normal life again but Thanks to Dr. Rajesh!! In fact ""Thanks"" becomes a small word....', 'Visited For ParalysisI recommend the doctorHappy with: Doctor friendlinessExplanation of the health issueTreatment satisfactionValue for moneyWait timeRajesh doctor is a gem peraon. When my husband got attacked with paralysis i was completely blank,all ways were closed for me and i was totally lost. At that time the confidence what the doctor gave was unexpressive.we never felt that we talking with a doctor. He is so one among us. The explaination about a descease with the examples what he does is tremendous.He has given rebirth to my husband.My husband is a very perfect now.Dr Rajesh is very flexible comfortably available to patients.Totally in word he is a PERFECT DOCTOR.Finally i wish him all the best let God give him still more enargy to help people like how he is doing now.', ""I recommend the doctorNothing but a top notch doctor supported by outstanding staff at the People Tree Hospital in Yeshwantapur. My Uncle had severe numbness on his right hand and leg . Dr Rajesh was very clear in his diagnosis and the challenges of my uncle condition. He is a busy specialist with a resultant high case load. Is he really warm and fuzzy -no. Is he professional,knowledgeable and caring - most definately.I am thankful to Practo which helped me in getting Best Neurologist near my locality.I am very thankful for this Doctor's expertise and attention. Not sure where other raters are coming from. He is a specialist that works from referrals and results of specialized testing(where he did confirm my results with timely independent testing carried out by himself). Dr Rajesh is an expert Neurologist who I have nothing but high esteem for."", ""Visited For Peripheral NeuropathyI recommend the doctorHappy with: Doctor friendlinessExplanation of the health issueTreatment satisfactionValue for moneyWait timeOverall very satisfied with my experience. Doctor did thorough examination, explained probable reasons and test. provided very good advise on diet plan and dos and don'ts. Thank you Doctor for taking time and explaining me in detailAlso good experience with Trustwell hospital right from reception, lab and all other staff members, thank you to all"", 'Visited For Neurological ProblemsI recommend the doctorHappy with: Doctor friendlinessExplanation of the health issueTreatment satisfactionValue for moneyWait timeDr.Rajesh ** **** ************* *** understands our problems quickly and provide Treatmnet. I would recommend this doctor to the people who has neurological issues.', 'Visited For GiddinessI recommend the doctorHappy with: Doctor friendlinessExplanation of the health issueTreatment satisfactionValue for moneyDoctor focused his time on diagnosis of the problem, enquired to know the full background of the health issue. He is very kind and above all very good human being.After proper assessment he referred us to vertigo specialist.Thank you so much Doctor.']"
9,Dr. A.K. Roy,"MBBS, MD - Medicine, DM - Neurology","Neurologist
44 Years Experience Overall  (42 years as specialist)","98, Kodihalli, Landmark: HAL Bus Stop, Bangalore",Mon,01:00 PM - 08:00 PM,54% (57 votes),₹900,https://www.practo.com/bangalore/doctor/dr-ajith-kumar-roy-neurologist-2?practice_id=630200&specialization=Neurologist&referrer=doctor_listing,"['I recommend the doctorFrom the past two months, I am consulting him and the treatment has been a great satisfaction for me. He gives a good time to understand the issues and explains the analysis in detail. The waiting time was comparatively better this time because I have booked an online appointment prior to the visit.', 'Visited For Neurological ProblemsI recommend the doctorHappy with: Wait time** ** *** ** **** *** ***** ******* * **** ****i treatmented also before but I can not got success..and my wife saraswati mondal she is also his under treatment ***** ******** **** *** ********* ***many problems are in hospital now ..not so good maintenance for all patients .I went there three or four time for treatment but I m all failure there and mostly also costly.', 'Visited For TremorsI do not recommend the doctorHoped for better: Doctor friendlinessExplanation of the health issueTreatment satisfactionValue for moneyWait timeThe staff at the neuro department are horrifically rude, **** ***** ***** ******** ** ** **** *** ******** ****** Dr.Roy was seen unbothered with my health issues and was more interesting about where I am studying (USA). He was talking about New York and New Jersey instead of focusing on what really mattered. ** *** *** *** ********** ** **** ******* *** ***** ****** *** *** ***** ** ** * ******** I wasted over 6,000 Rupees (with EEG, bloodwork, & etc) and waited over 7hrs (9am-5pm) hrs to end up being prescribed with Multivitamins. **** ** *** * **** ** **** ********* ** *** ****** ** ********** *** * ********* **** **** ****** *** *********', 'Visited For Dementia TreatmentI do not recommend the doctorHoped for better: Doctor friendlinessExplanation of the health issueTreatment satisfactionWait timeVisited doctor for my father\'s dementia treatment. And it was a mistake. While I was explaining the health issues, Dr A K Roy was interested in reading about ""Uruguay\'s Football team"" on his PC. ***** *** ********* ** ******** ********* *** ***** *** had to be admitted to manipal hospital. ***** ***** *** *********** ** ******** ********* *** ****** The doctor is very sarcastic in nature and very much arrogant. I would not recommend this doctor.', ""Visited For Nerve and Muscle DisordersStrokeI do not recommend the doctorHoped for better: Treatment satisfactionWait timeValue for moneyWas not happy with the experience, had a long wait and huge rush despite booking an appointment well in advance. Visited the doctor as my dad's left hand suddenly went paralysed. Doctor did not spend enough time with my dad and what he diagnosed to be radial nerve palsy ****** **** * ****** * *** **** ****** ** *** ****** *** ***** **** **** **** ** *** *** **** **** ************ **** ************ ***** **** **** ******** *** ***** ** ****** ****** **** **** ******** ******* *** *********** ********* **** ****** *** *******"", 'Visited For Nerve and Muscle DisordersI recommend the doctorHappy with: Explanation of the health issueTreatment satisfactionIm contuning the medicine as they recomended around 6 months and after that they told me to went there for a medical cheakup but for some isus i could not go ..but but through someone i send my every report card everything and medicine also and also told him that im as usual not feel better anymore ..but the doctors dont change the medicine anymore nothing they just gave the double dose of same medicine..but after all that im as usual ..so what to do ?? Double dose could do nothing .im taking the double dose around 2 months but the medicine are same .', 'Visited For Neurological ProblemsI recommend the doctorHappy with: Treatment satisfactionDr. Roy is kind and considerate in listening and offering appropriate prescription. There was thoroughness in his professional approach and application of his long experience.', ""Visited For TremorsI do not recommend the doctorHoped for better: Treatment satisfactioni came here in July 2015 for tremors of both hand . he didn't listen my problem . He treated for LVL pain ***** ** *** ** ******* * ** ***** ***** **********"", 'Visited For Neurological ProblemsI do not recommend the doctorHoped for better: Treatment satisfactionI was not happy with doctor treatment.Came here with lot of expectations.******** ***** *** ******** *** ******* ** ***.******** ********* *** *** **** *** not friendly at all.Once I called him to let himKnow my mother condition he told me to connect with local doctors.This is the answer that I got from the doctor which made me surprise', 'Visited For Vagus Nerve Stimulation (Epilepsy)Neurological ProblemsI recommend the doctorHappy with: Doctor friendlinessExplanation of the health issueTreatment satisfactionValue for moneyWait timeYou are very great sir..till now my treatment is running I am very satisfied your treatment..this word is are to short explain about your greatness***** ** **** ***** ****** *** *** ***** *************please consult about your problem he is very such a great person']"
10,Dr. P.C Mohan,"MBBS, Diploma in Child Health (DCH), DM - Neurology","Neurologist
26 Years Experience Overall  (24 years as specialist)","67, Uttarahalli Road, Landmark: Near Abhiman Studio & SGBIT Engineering College Campus 1st Building, Bangalore",Mon - Sat,10:30 AM - 03:30 PM,73% (15 votes),₹700,https://www.practo.com/bangalore/doctor/dr-p-c-mohan-1-neurologist-1?practice_id=664585&specialization=Neurologist&referrer=doctor_listing,"['I recommend the doctorWonderful experience with Dr. PC Mohan.Dr. PC Mohan was a wonderful Neurologist and he is always helpful and kind. I visited doctor for migraine he gave me four tablets and said whenever migran comes just take this tablet. I took the tablet till now there is no migran since 13years. I also consulted Dr PC Mohan when my father had a facial strok. My father also appriceated his tretment and hospitality. I am so glad I choose him and would highly recommend.', 'Visited For Neurological ProblemsGiddinessI recommend the doctorGood experienced doctor. His explaination about the issue was good n he gave right solution to our health issue.', ""Visited For Alzheimer's DiseaseI do not recommend the doctorMy grandfather was treated very badly and we were not given correct situation and finally we lost him."", ""Visited For Stroke TreatmentI do not recommend the doctorVery bad.. doesn't give enough time to the patient's to explain their illnesses, ***** **** ************* he's always in some sort of hurry, guess he's always trying to catch a plane..."", 'Visited For HeadacheI recommend the doctorThe doctor was punctual, not many crowd in hospital.Doctor has patience in listening to the patient ,given good advice and moral support', 'Visited For Nerve and Muscle DisordersI recommend the doctorgood doctor he doesnt jump to conclusion without complete diagnosis.very patient and experienced doctor']"
11,Dr. Manjunath M,"MD - General Medicine, DM - Neurology, MBBS","Neurologist
17 Years Experience Overall  (7 years as specialist)","98, Kodihalli, Landmark: HAL Bus Stop, Bangalore",Mon,01:00 PM - 04:00 PM,100% (27 votes),₹900,https://www.practo.com/bangalore/doctor/dr-manjunath-m-1-neurologist?practice_id=630200&specialization=Neurologist&referrer=doctor_listing,"[""Visited For IschemicStroke TreatmentI recommend the doctorHappy with: Doctor friendlinessExplanation of the health issueTreatment satisfactionValue for moneyDr. Manjunath treats his patients with utmost importance and care. He always revisits the medication that was given and prescribes the next dosage. I visited him for transient ischemic attacks and he treated me for 6 mts according the symptoms, I'm back to normal now. He also patiently listens to us and does the correct physical exam. Also, he has a personal connect with the patient to understand history which is very rare in doctors. I will recommend him highly."", ""Visited For Neurological ProblemsI recommend the doctorHappy with: Doctor friendlinessExplanation of the health issueTreatment satisfactionValue for moneyWait timeI took my father to manipal hospital in the year 2018. My father was a Craniopharyngioma(Brain Tumor) exsicion patient since 2005. Till 2017 my father was treated by other neurologist in some other reputed hospital. In the year 2018 his condition got worse. He had 90 percent loss of memory and mobility issues. The doctor from the other reputed hospital couldn't identify the root cause. We had no hopes of my father survival. At last we went to manipal hospital. Luckily we chose Dr Manjunath. I think he is God for us. He went through the patient past history. He patiently treated my father. Of course he had to start from scratch with his medications. My father was terminally ill. We slowly got little hopes of his survival. The severity of the illness was to such an extent, he was hospitalized four times in the span of 6 months. It's very challenging to retrieve mobility and trust me doctor successfully retrieved both mobility and 90 percent lost memory. Doctor used to visit even on sundays. He is such an amazing doctor. He listen to the events occurred very carefully. Retrieving 90 percent memory is not a joke at the age of 65. It's challenging and yes the doctor did it. Doctor tried to find the root cause in every way, from doing all kinds of tests to sending samples to nimhans hospital (for spl tests). Hats off to you sir. My father is an Rtd Police officer. He is doing well since 2018. My father is having regular consultation with the doctor. I highly recommend doctor for any neurological issues. Writing the reviews from Ireland."", 'Visited For StrokeEpilepsyI recommend the doctorHappy with: Doctor friendlinessExplanation of the health issueTreatment satisfactionMy mother aged 67 years used to loose consciousness and fall down for 20-30 seconds and again regain consciousness. While walking sometimes suddenly her movement used to speed up, losing consciousness and falling down used to happen almost 5-6 times everyday. then I consulted doctor based on practo review:Doctor manjunath was so cordial and patiently listened all problems, he prescribed ct scan, eeg and few blood tests. after that he investigated and told there is blockage in head right artery. so he suggested three medicines, immediately after taking medicine next onwards my mother stopped falling down. I am thankful to you Manjunath sir for your proper diagnosis and treatment. Also I want to once again reiterate he is very friendly and patient.', ""Visited For Neurological dysfunctionMigraine TreatmentParkinson's Disease TreatmentDementia TreatmentTremor TreatmentI recommend the doctorHappy with: Doctor friendlinessExplanation of the health issueTreatment satisfactionValue for moneyWait timeDr Manjunath is a brilliant doctor. He was the first one to correctly diagnose my father 's Parkinson disease. My father's tremors and balance issues have been reduced so much after we took the medication he prescribed. He charges very less as well and spends 25 minutes per patient. I am so happy to have met a great neurologist in Bangalore. One more thing, Dr Manjunath is so well versed with the latest research and findings in neuroscience, he has kept himself updated with the recent advancements."", 'Visited For Headache ManagementI recommend the doctorHappy with: Doctor friendlinessValue for moneyAll experience was good and satisfactory.Neurologist .Dr.Manjunath M was very friendly and He checked up beautifully and Suggest very Normal and minimum medicine.. After take Tryptomer tablet I feel very weak...... Many many thanks to Dr. Manjunath M..', 'I recommend the doctorHappy with: Doctor friendlinessExplanation of the health issueTreatment satisfactionValue for moneyMy family should thankful to doctor *** ***** ** ****** **** ******* ******* ***** **** ** * ***** I am strongly recommend manjunath is only one doctor in India who cures vertigo and disorder movement. As Indian I am feeling proud such a doctor we have', ""I recommend the doctorHappy with: Treatment satisfactionDr Manjunath *** ***** ***** ** treating rare neuro disorders like cervical dystonia. My father has been suffering from this disorder for about 8 years now, since the time we started taking treatment from Dr Manjunath my father's movement problem is under control. He identified the correct treatment for my father, we are regularly visiting him.I appreciate Dr Manjunath's interaction with patients and his positive approach towards treating the ailment."", 'Visited For Neurological ProblemsI recommend the doctorHappy with: Doctor friendlinessExplanation of the health issueTreatment satisfactionI had visited doctor Manjunath for the complete body ache. He was smart to understand my health concern immediately. He suggested a couple of tests upon listening patiently, then upon receiving the report met the doctor. He checked the reports & said report looks normal & prescribed me the relevant medicines. This really helped me to get myself feel better than before I visited the doctor. Thanks a lot for your care for understanding the patient health issues. I wish I can get out my health concern completely. Thank you doctor!!', 'Visited For Stroke TreatmentI recommend the doctorVisited doctor for my father’s treatment. He listens to the patients issues patiently. My father is still recovering and I hope he will recover soon with the time to time guidance of the doctor.', 'Visited For GiddinessI recommend the doctorHappy with: Doctor friendlinessExplanation of the health issueTreatment satisfactionValue for moneyI really recommend doctor very friendly and explain each and every thing after talking to him I felt relief']"
12,Dr. Sanjiv C C,"MBBS, DM - Neurology","Neurologist
32 Years Experience Overall  (26 years as specialist)","Number-24, South End Road, Basavanagudi, Bangalore, Landmark: Opposite to Shiva Shakti Convention Hall, Diagonally opposite to balaji Medicals, Next to canara bank, Bangalore",Mon - Sat,04:00 PM - 06:00 PM,77% (163 votes),₹670,https://www.practo.com/bangalore/doctor/dr-sanjiv-neurologist?practice_id=711641&specialization=Neurologist&referrer=doctor_listing,"[""Visited For Parkinson's Disease TreatmentI recommend the doctorHappy with: Wait timeHe tested the patient thoroughly and then prescribed the medicine. He mentioned the different treatments available"", 'Visited For GiddinessI recommend the doctorI know this doctor from last 25 yrs, undergoing treatment . Today i took my relative,he was also very happy.I recommend this doctor any issues related to nerve and brain, epilepsy etc etc.', 'Visited For Neurological ProblemsI do not recommend the doctor**** *** ****** *** *** ******** not at all active and least bothered about patients issues. Loss of money they have charged more than what is given on practo here. He is like go to that doctor go to this doctor so annoying *** **** ****** am unable to put i in wordsDr. Sanjiv C C repliedHello The doctor advices according to the present clinic scenario. You wanted your way to treat as per google, not possible. Hospital charge es are different from clinic charges. Do not generalise the issue', 'I do not recommend the doctorHoped for better: Doctor friendlinessExplanation of the health issueTreatment satisfactionValue for moneyOur experience was very bad. Doctor do not have patience to listen to patients and hear what they are going through. I would not recommend at all.', 'Visited For Nerve and Muscle DisordersNeurological ProblemsI do not recommend the doctorVery unhappy with the entire consultation process. When explaining the symptoms, this doctor was completely busy on his phone and laptop and not listening or looking at me. Moreover,he picked a call in the middle of consultation and spoke for 10-15 mins, without caring about the patient in front of him. ** ******* ****** *************** Complete loss of the consultation cost. Not worth it.In the end he suggested some medication, but I will go to another neurologist for a 2nd opinion.Dr. Sanjiv C C repliedHello We need to attend emergency phone calls from the hospital and we need to answer serious emergency patients also', 'I recommend the doctorHappy with: Doctor friendlinessExplanation of the health issueTreatment satisfactionValue for moneyWait timeI visited docter for my son treatment.Docter is very cooperative and listening every problem and very humble.His behavier is very nice.sort out every problem.Dr. Sanjiv C C repliedThanks', 'I do not recommend the doctorI visited the doctor for my lower back pain. The entire consultation got over in less than 5-7 minutes (of which 2-3 minutes he was fiddling with his phone) He didn’t even care to ask about history such as past treatment, any medication taken etc. I went on telling everything on my own. The doctor seemed uninterested during the entire conversation.He prescribed an MRI and some tablets. As soon as I was out of his cabin, his staff asked me to confirm the time for the MRI. When I told him that I will get it done elsewhere as per my convenience. He started insisting that I should get it done at their centre only as their results are more accurate than others (oh please !!!)Further, the staff had no records of my appointment through Practo. It was like a walk in where you go and ask for an appointment at the reception and they write your name at the end of waiting list. They also didn’t have the swiping machine for payment. Luckily I had some cash, else I had to look around for an ATM with the severe back pain.Overall, it was not a pleasant experience.Dr. Sanjiv C C repliedFrom clinic staff The doctor has spent with you reasonable time with you and evaluated . H e is senior neurologist with several years s experience. It requires few minutes to make a reasonable diagnoisis. If doctors gets emergency phone call from ICU hospital, he has to attend and cannot say no. If he is working in the same centre, facilities are available, MRI usually done there for Better interpretations and future studies, we recommend here. On particular day if the doctor has got many appointments it is some difficult and previous held up due to emergencies, things can be delayed. Sorry for the events.', 'Visited For Movement DisorderI recommend the doctorHappy with: Doctor friendlinessValue for moneyI had a very good experience with Dr. Sanjiv a pioneer neurologist who cares the patient in friendly way. My brother had been referred to him with movement disorder complication. Doctors investigations are satisfactory and his prescriptions seems to be more productive. My brother right now after a week treatment, giving little positive feedback which is better than previous consultations. I strongly recommend the doctor as well as celera diagnostics for its well equipped and modernised facilities.Dr. Sanjiv C C repliedThanks', ""I recommend the doctorHappy with: Explanation of the health issueDoctor friendlinessTreatment satisfactionSanjeev C C is great doctor and my impression is he is good human being. He is friendly and listen to your problem carefully and advise on the treatment,Instead of directly jumping to conclusion. I visited Sanjeev C C before as well for second opinion when my mother got Paralysis stroke a year and half back and he was very genuine to his opinion unlike other doctor. I am very happy that he is listening to patient's problem and providing genuine treatment.Dr. Sanjiv C C repliedThanks,god bless you"", 'Visited For Neurological ProblemsI do not recommend the doctorHoped for better: Doctor friendlinessExplanation of the health issueTreatment satisfactionValue for moneyWait timeWriting on behalf of my cousin......Very bad experience. Kept patients waiting outside while he was busy on whatsapp or chatting on the phone. Did not bother to hear our complaints and attended to us all the while talking on phone. He sent us away within a few seconds to get one more scanning done and then return. We ignored his advice and consulted another specialist.']"
